{
  "schema_version": 1,
  "id": "choice-criteria-order",
  "profile": "lfm3-d1/text/v1",
  "title": "Criteria keep request order, not key order",
  "covers": ["choice-order", "json-order"],
  "artifact": "d1-2b-q4km",
  "settings": "cpu-t4-fa-off",
  "request_text": "{\"state\": \"I was charged twice this month, please refund one of them.\", \"questions\": {\"q\": {\"type\": \"choice\", \"instructions\": \"Which option fits best?\", \"criteria\": {\"zeta\": \"Z team\", \"alpha\": \"A team\", \"mu\": \"M team\", \"beta\": \"B team\"}}}}",
  "upstream": {
    "parse": {
      "questions": [
        {
          "id": "q",
          "type": "choice",
          "keys": ["zeta", "alpha", "mu", "beta"]
        }
      ]
    },
    "prepare": {
      "passes": [
        {
          "question": "q",
          "prompt": "<|startoftext|><|im_start|>user\nI was charged twice this month, please refund one of them.\n\n\nQUESTION:\nWhich option fits best?\n\nOptions:\nA Z team\nB A team\nC M team\nD B team\n\nReply with the option code only.<|im_end|>\n<|im_start|>assistant\n<think></think>",
          "token_ids": [124894, 124899, 5922, 207, 49, 452, 14917, 10625, 532, 5304, 20, 8193, 52966, 734, 302, 876, 64673, 63509, 833, 28327, 7331, 24612, 1737, 64929, 13314, 833, 41, 895, 2909, 207, 42, 334, 2909, 207, 43, 356, 2909, 207, 44, 378, 2909, 8, 57922, 415, 278, 7331, 4713, 1049, 22, 124900, 207, 124899, 63514, 207, 124901, 124902],
          "output_index": 55,
          "select": [41, 334, 42, 378, 43, 340, 44, 388]
        }
      ],
      "answers": [
        {
          "question": "q",
          "type": "choice",
          "pass": 0,
          "groups": [
            {
              "key": "zeta",
              "code": "A",
              "range": [0, 2]
            },
            {
              "key": "alpha",
              "code": "B",
              "range": [2, 4]
            },
            {
              "key": "mu",
              "code": "C",
              "range": [4, 6]
            },
            {
              "key": "beta",
              "code": "D",
              "range": [6, 8]
            }
          ],
          "temperature": "1.337398",
          "temperature_f32": "0x3fab2fdc"
        }
      ]
    },
    "evaluate": {
      "source": "model",
      "raw_scores": [
        ["0x40f1d8c8", "0x4061eb81", "0x4102234d", "0x40883b07", "0x40fb6e1f", "0x4081190e", "0x40faad5a", "0x408ea3f9"]
      ],
      "scores": [
        ["0x40f1d8c8", "0x4102234d", "0x40fb6e1f", "0x40faad5a"]
      ]
    },
    "finalize": {
      "answers": {
        "q": {
          "type": "choice",
          "choice": "alpha",
          "probabilities": {
            "zeta": 0.19926878450756269,
            "alpha": 0.30651637742493071,
            "mu": 0.24928128291281415,
            "beta": 0.24493355515469242
          },
          "confidence": 0.30651637742493071
        }
      },
      "usage": {
        "input_tokens": 56,
        "output_tokens": 0
      }
    },
    "server": {
      "status": 200,
      "agrees": true
    }
  },
  "xybrid": {
    "parse": "match",
    "prepare": "match",
    "evaluate": "reference",
    "finalize": "match"
  }
}
