{
  "schema_version": 1,
  "id": "g1h-23-noul-63-tokens",
  "profile": "lfm3-d1/text/v1",
  "title": "G1 held-out slot 23: noul 63 tokens (travel)",
  "covers": [
    "state-string",
    "noul-no-criteria"
  ],
  "notes": "Written by tools/conformance/decision_g1/make_heldout.py from its fixed recipe; upstream is left for the upstream oracle, and the xybrid expectations are proposals.",
  "artifact": "d1-2b-f16",
  "settings": "cpu-t4-fa-off",
  "request_text": "{\"state\": \"My train is delayed by ten minutes. (1) The traveller checked in online the evening before. also noted today again later here then too still now soon please thanks\", \"questions\": {\"answer\": {\"type\": \"noul\", \"instructions\": \"Is the traveller stranded overnight?\"}}}",
  "upstream": {},
  "xybrid": {
    "parse": "match",
    "prepare": "match",
    "evaluate": "reference",
    "finalize": "match"
  }
}
