{
  "schema_version": 1,
  "id": "math-media-temperature",
  "profile": "lfm3-d1/text/v1",
  "title": "With media, the image temperature replaces the question's",
  "covers": ["math-media-temperature"],
  "notes": "The text profile has no media; recorded for O2. format_answer ran with has_media = true, no media was sent.",
  "artifact": "d1-2b-q4km",
  "metadata": {
    "set": {
      "lfm3.decision.temperature.image": "f32:2.5"
    }
  },
  "settings": null,
  "request_text": "{\"state\": \"I was charged twice this month, please refund one of them.\", \"questions\": {\"q\": {\"type\": \"choice\", \"instructions\": \"Which option fits best?\", \"criteria\": {\"a\": \"A\", \"b\": \"B\", \"c\": \"C\"}}}}",
  "has_media": true,
  "upstream": {
    "parse": {
      "questions": [
        {
          "id": "q",
          "type": "choice",
          "keys": ["a", "b", "c"]
        }
      ]
    },
    "prepare": {
      "passes": [
        {
          "question": "q",
          "prompt": "<|startoftext|><|im_start|>user\nI was charged twice this month, please refund one of them.\n\n\nQUESTION:\nWhich option fits best?\n\nOptions:\na A\nb B\nc C\n\nReply with the option code only.<|im_end|>\n<|im_start|>assistant\n<think></think>",
          "token_ids": [124894, 124899, 5922, 207, 49, 452, 14917, 10625, 532, 5304, 20, 8193, 52966, 734, 302, 876, 64673, 63509, 833, 28327, 7331, 24612, 1737, 64929, 13314, 833, 73, 334, 207, 74, 378, 207, 75, 340, 8, 57922, 415, 278, 7331, 4713, 1049, 22, 124900, 207, 124899, 63514, 207, 124901, 124902],
          "output_index": 48,
          "select": [73, 267, 74, 293, 75, 280]
        }
      ],
      "answers": [
        {
          "question": "q",
          "type": "choice",
          "pass": 0,
          "groups": [
            {
              "key": "a",
              "code": "a",
              "range": [0, 2]
            },
            {
              "key": "b",
              "code": "b",
              "range": [2, 4]
            },
            {
              "key": "c",
              "code": "c",
              "range": [4, 6]
            }
          ],
          "temperature": "1.337398",
          "temperature_f32": "0x3fab2fdc"
        }
      ]
    },
    "evaluate": {
      "source": "synthetic",
      "raw_scores": [
        ["0x40800000", "0x40400000", "0x3fc00000", "0x3f000000", "0xc0000000", "0xc0400000"]
      ],
      "scores": [
        ["0x40800000", "0x3fc00000", "0xc0000000"]
      ]
    },
    "finalize": {
      "answers": {
        "q": {
          "type": "choice",
          "choice": "a",
          "probabilities": {
            "a": 0.68559014557244058,
            "b": 0.25221451962583724,
            "c": 0.062195334801722194
          },
          "confidence": 0.68559014557244058
        }
      },
      "usage": {
        "input_tokens": 49,
        "output_tokens": 0
      }
    }
  },
  "xybrid": {
    "load": "match",
    "parse": "match",
    "prepare": "match",
    "evaluate": "given",
    "finalize": "out_of_scope"
  }
}
