{
  "schema_version": 1,
  "id": "hf-diff-key-whitespace",
  "profile": "lfm3-d1/text/v1",
  "title": "Space-padded single-letter keys are not one byte, so upstream codes them A..C",
  "covers": [
    "choice-letter-keys"
  ],
  "notes": "Single-letter keys with surrounding spaces: the reference strips them and uses the letters as codes; llama.cpp needs exactly one byte, so it codes them A..C. Written by tools/conformance/decision_hf/make_cases.py: upstream is left for the upstream oracle to fill, and the xybrid expectations are proposals.",
  "artifact": "d1-2b-f16",
  "settings": "cpu-t4-fa-off",
  "request_text": "{\"state\": \"The capital of France is Paris.\", \"questions\": {\"capital\": {\"type\": \"choice\", \"instructions\": \"Which city is the capital?\", \"criteria\": {\" a\": \"Paris\", \"b \": \"Lyon\", \"c\": \"Marseille\"}}}}",
  "upstream": {},
  "xybrid": {
    "parse": "match",
    "prepare": "match",
    "evaluate": "reference",
    "finalize": "match"
  }
}
