{
  "schema_version": 1,
  "id": "noul-yes-no-aliases",
  "profile": "lfm3-d1/text/v1",
  "title": "yes/no keys are not read for lfm3-d1: upstream ignores them and prints no lines",
  "covers": ["noul-partial-criteria", "divergence"],
  "notes": "Upstream drops descriptions given under yes/no without a word; xybrid refuses criteria keys other than true and false.",
  "artifact": "d1-2b-q4km",
  "settings": "cpu-t4-fa-off",
  "request_text": "{\"state\": \"I was charged twice this month, please refund one of them.\", \"questions\": {\"q\": {\"type\": \"noul\", \"instructions\": \"Refund?\", \"criteria\": {\"yes\": \"They ask for money back\", \"no\": \"Anything else\"}}}}",
  "upstream": {
    "parse": {
      "questions": [
        {
          "id": "q",
          "type": "noul",
          "keys": ["true", "false"]
        }
      ]
    },
    "prepare": {
      "passes": [
        {
          "question": "q",
          "prompt": "<|startoftext|><|im_start|>user\nI was charged twice this month, please refund one of them.\n\n\nQUESTION:\nRefund?\n\nReply with yes or no only.<|im_end|>\n<|im_start|>assistant\n<think></think>",
          "token_ids": [124894, 124899, 5922, 207, 49, 452, 14917, 10625, 532, 5304, 20, 8193, 52966, 734, 302, 876, 64673, 63509, 833, 9405, 855, 64929, 57922, 415, 18171, 432, 794, 1049, 22, 124900, 207, 124899, 63514, 207, 124901, 124902],
          "output_index": 35,
          "select": [11683, 12447, 2243, 4547, 19598]
        }
      ],
      "answers": [
        {
          "question": "q",
          "type": "noul",
          "pass": 0,
          "groups": [
            {
              "key": "true",
              "code": "true",
              "range": [0, 2]
            },
            {
              "key": "false",
              "code": "false",
              "range": [2, 5]
            }
          ],
          "temperature": "1.337398",
          "temperature_f32": "0x3fab2fdc"
        }
      ]
    },
    "evaluate": {
      "source": "model",
      "raw_scores": [
        ["0x41053553", "0x413c778a", "0x4063fbf2", "0x40db7cae", "0x3ff60b1b"]
      ],
      "scores": [
        ["0x413c778a", "0x40db7cae"]
      ]
    },
    "finalize": {
      "answers": {
        "q": {
          "type": "noul",
          "noul": 0.97537225583792742
        }
      },
      "usage": {
        "input_tokens": 36,
        "output_tokens": 0
      }
    },
    "server": {
      "status": 200,
      "agrees": true
    }
  },
  "xybrid": {
    "parse": {
      "refuse": "unknown_field"
    },
    "prepare": "not_reached",
    "evaluate": "not_reached",
    "finalize": "not_reached"
  }
}
