{
  "schema_version": 1,
  "id": "g1h-02-choice-3",
  "profile": "lfm3-d1/text/v1",
  "title": "G1 held-out slot 2: choice 3 (sports)",
  "covers": [
    "state-string",
    "choice-order"
  ],
  "notes": "Written by tools/conformance/decision_g1/make_heldout.py from its fixed recipe; upstream is left for the upstream oracle, and the xybrid expectations are proposals.",
  "artifact": "d1-2b-f16",
  "settings": "cpu-t4-fa-off",
  "request_text": "{\"state\": \"The match was stopped in the second set after the player injured his ankle and could not continue.\", \"questions\": {\"answer\": {\"type\": \"choice\", \"instructions\": \"How did the event end for the athlete or team?\", \"criteria\": {\"unknown\": \"The text does not say\", \"postponed\": \"Moved to another date\", \"personal_best\": \"A best-ever result\"}}}}",
  "upstream": {},
  "xybrid": {
    "parse": "match",
    "prepare": "match",
    "evaluate": "reference",
    "finalize": "match"
  }
}
