{
  "schema_version": 1,
  "id": "choice-criteria-array",
  "profile": "lfm3-d1/text/v1",
  "title": "Array choice criteria are refused",
  "covers": ["refusal-parse"],
  "artifact": "d1-2b-q4km",
  "settings": null,
  "request_text": "{\"state\": \"I was charged twice this month, please refund one of them.\", \"questions\": {\"q\": {\"type\": \"choice\", \"instructions\": \"x\", \"criteria\": [\"a\", \"b\"]}}}",
  "upstream": {
    "parse": {
      "refusal": {
        "exception": "invalid_argument",
        "status": 400,
        "type": "invalid_request_error",
        "message": "questions.q: \"criteria\" must be a non-empty object"
      }
    },
    "server": {
      "status": 400,
      "agrees": true
    }
  },
  "xybrid": {
    "parse": {
      "refuse": "invalid_criteria"
    },
    "prepare": "not_reached",
    "evaluate": "not_reached",
    "finalize": "not_reached"
  }
}
